{"$schema":"https://json-schema.org/draft/2020-12/schema","$id":"https://gentle-ai.dev/schema/review/validator/v1","title":"Gentle AI targeted validator result","type":"object","additionalProperties":false,"required":["targeted_validation_request_hash","correction_target_identity","original_criteria","correction_regression","follow_ups"],"properties":{"targeted_validation_request_hash":{"$ref":"#/$defs/sha256"},"correction_target_identity":{"$ref":"#/$defs/sha256"},"original_criteria":{"$ref":"#/$defs/check"},"correction_regression":{"$ref":"#/$defs/check"},"follow_ups":{"type":"array","items":{"type":"object","additionalProperties":false,"required":["observation","proof_refs"],"properties":{"observation":{"type":"string"},"proof_refs":{"type":"array","minItems":1,"items":{"type":"string","pattern":"\\S"}}}}}},"allOf":[{"if":{"properties":{"correction_regression":{"type":"object","properties":{"passed":{"const":false}},"required":["passed"]}},"required":["correction_regression"]},"then":{"properties":{"correction_regression":{"type":"object","properties":{"regressions":{"minItems":1}},"required":["regressions"]}}}}],"$defs":{"sha256":{"type":"string","pattern":"^sha256:[0-9a-f]{64}$"},"check":{"type":"object","additionalProperties":false,"required":["passed","evidence"],"properties":{"passed":{"type":"boolean","description":"true means the named check passed; false means the named check failed."},"evidence":{"type":"array","minItems":1,"items":{"type":"string"}},"regressions":{"type":"array","items":{"$ref":"#/$defs/regression"},"description":"Required with at least one entry when this is correction_regression and passed is false: one entry per observed regression, omitted or empty otherwise."},"inspection":{"$ref":"#/$defs/inspection"}},"allOf":[{"if":{"properties":{"inspection":{"type":"object","properties":{"status":{"const":"unavailable"}},"required":["status"]}},"required":["inspection"]},"then":{"properties":{"inspection":{"type":"object","required":["reason"]}}}}]},"inspection":{"type":"object","additionalProperties":false,"required":["status"],"properties":{"status":{"type":"string","enum":["completed","unavailable"],"description":"completed means this check's verdict came from actually reading the frozen candidate trees. unavailable means it did not, and this check produced no verdict."},"reason":{"type":"string","minLength":1,"description":"Required when status is unavailable: why the frozen candidate trees could not be read."}},"description":"Optional. Omit this field entirely when inspection completed normally -- every check that predates this field already assumed that default. Never infer unavailable from evidence wording; only this typed field marks a check inconclusive."},"regression":{"type":"object","additionalProperties":false,"required":["location","claim","proof_refs"],"properties":{"id":{"type":"string","description":"Optional explicit ID; omit it to receive a native-assigned ID."},"location":{"type":"string","description":"One canonical repository-relative path:line or inclusive path:start-end span.","pattern":"^.+:[1-9][0-9]*(?:-[1-9][0-9]*)?$"},"claim":{"type":"string","minLength":1},"proof_refs":{"type":"array","minItems":1,"items":{"type":"string","pattern":"\\S"}}}}},"examples":[{"targeted_validation_request_hash":"sha256:0000000000000000000000000000000000000000000000000000000000000000","correction_target_identity":"sha256:1111111111111111111111111111111111111111111111111111111111111111","original_criteria":{"passed":true,"evidence":["acceptance test passed"]},"correction_regression":{"passed":true,"evidence":["regression test passed"]},"follow_ups":[]}]}