{"targeted_validation_request_hash":"sha256:0000000000000000000000000000000000000000000000000000000000000000","correction_target_identity":"sha256:1111111111111111111111111111111111111111111111111111111111111111","original_criteria":{"passed":true,"evidence":["acceptance test passed"]},"correction_regression":{"passed":true,"evidence":["regression test passed"]},"follow_ups":[]}
